Ball ID,Over/Ball,Innings,Team,Batsman,Bowler,Commentary
1784712476374,$undefined,$undefined,,,,"<b>India</b> Squad: Abhishek Sharma, Ishan Kishan(w), Tilak Varma, Shreyas Iyer(c), Shivam Dube, Rinku Singh, Suryansh Shedge, Prince Yadav, Yash Thakur, Ashok Sharma, Mayank Yadav, Vaibhav Sooryavanshi, Prabhsimran Singh, Harsh Dubey, Ravi Bishnoi"
1784712600873,$undefined,$undefined,,,,"<b>Zimbabwe</b> Squad: Brian Bennett, Tadiwanashe Marumani(w), Dion Myers, Sikandar Raza(c), Ryan Burl, Brad Evans, Wellington Masakadza, Wessly Madhevere, Milton Shumba, Richard Ngarava, Tanaka Chivanga, Blessing Muzarabani, Ben Curran, Tafadzwa Tsiga, Newman Nyamhuri"
1784712607224,$undefined,$undefined,,,,<b>Squads:</b>
1784712607234,$undefined,$undefined,,,,$28
1784799964903,$undefined,$undefined,,,,"<b>11:45 Local Time, 09:45 GMT, 15:15 IST:</b> Hello and welcome to our live coverage of the first T20I between Zimbabwe and India. Had it not been for everything that has unfolded over the past month, India's primary objective in this series would have been to test their bench strength in a format they have dominated ever since their semi-final exit at the 2022 T20 World Cup in Australia. Instead, they arrive in Harare with far more pressing concerns."
1784800081367,$undefined,$undefined,,,,"The back-to-back T20 World Champions are yet to register a victory since successfully defending their title earlier this year in February-March. Despite leading India to World Cup glory, Suryakumar Yadav was relieved of the captaincy and dropped from the T20I setup, with Shreyas Iyer taking over as captain to lead India's next phase in T20 cricket, with an eye on the 2028 Summer Olympics in Los Angeles and the T20 World Cup in Australia and New Zealand later that year. However, to say Iyer's tenure has got off to a rocky start would be putting it mildly. India were whitewashed 2-0 in Ireland before suffering a 4-0 drubbing in England. They now head to Zimbabwe for a three-match series, where the spotlight will not only be on youngsters looking to cement their places in the T20I squad but also on several senior players fighting to retain theirs."
1784800407188,$undefined,$undefined,,,,"The pressure will be firmly on India's batting unit. Apart from Rinku Singh and Prabhsimran Singh, every frontline batter in the squad was also part of the disappointing tour of the UK. While Iyer is still searching for his first win after seven T20Is as captain, he was the only Indian batter to show any real consistency against England. Meanwhile, Abhishek Sharma, Ishan Kishan, Shivam Dube and Tilak Varma all struggled, particularly against the hard-length bowling. Even Vaibhav Sooryavanshi, making his much-awaited debut, struggled against England. The challenge is unlikely to get any easier in Harare. The conditions will favour the seamers, and Zimbabwe possess the pace attack to exploit them. Richard Ngarava and Blessing Muzarabani will pepper the Indian batters with hard lengths, while Brad Evans and Newman Nyamhuri add further variety with their ability to move the ball."
1784800770275,$undefined,$undefined,,,,"India have travelled with an inexperienced pace attack featuring Prince Yadav, Mayank Yadav, Yash Thakur and Ashok Sharma, but they will relish the seam-friendly conditions in Harare. Harsh Dubey will be eager to stake his claim as Axar Patel's back-up, but it is Ravi Bishnoi who arguably has the most to prove. The legspinner endured a forgettable IPL 2026, and then conceded 60 runs in his four overs in the second T20I against England. Another underwhelming series could seriously hamper his T20I career."
1784801208921,$undefined,$undefined,,,,"Zimbabwe, on the other hand, are a team on the rise and a dangerous side in home conditions. Alongside a well-rounded pace attack, they boast several quality spin-bowling all-rounders led by Sikandar Raza. They recently beat Bangladesh in the one-off Test and the ODI series before narrowly losing the T20I series 2-1. Zimbabwe's fielding and catching proved to be their biggest undoing in the T20I series, with Raza going as far as calling it ""embarrassing."" If Zimbabwe can tighten up in the field and post competitive totals, they certainly have the bowling attack to trouble India. Stay tuned as we bring you the toss and team news shortly from Harare.."
1784801395830,$undefined,$undefined,,,,ICYMI: Zimbabwe's batter Milton Shumba has been ruled out of the T20I series due to a right hamstring injury. Innocent Kaia has been brought in as his replacement.
1784805729906,$undefined,1,ZIM,,,"<b>Sikandar Raza, right handed bat, comes to the crease</b>"
1784805734602,3.3,1,ZIM,Sikandar Raza,Prince Yadav,"Prince Yadav to Sikandar Raza, <b>wide</b>, moves away sharply but it's outside the guideline, Raza throws his bat at it but makes no connection"
1784805763289,3.3,1,ZIM,Sikandar Raza,Prince Yadav,"Prince Yadav to Sikandar Raza, no run, Raza thought he had covered the line of the ball which nips away from the length, but then had to open the face of the bat to guide it to the point area"
1784805781691,3.4,1,ZIM,Sikandar Raza,Prince Yadav,"Prince Yadav to Sikandar Raza, no run, 136kph length ball moving away, Raza defends it away from his body and to the cover-point"
1784805811461,3.5,1,ZIM,Sikandar Raza,Prince Yadav,"Prince Yadav to Sikandar Raza, no run, closer to the batter on this occasion but the length stays the same, Raza gets on top of it and turns it to square leg"
1784805842108,3.6,1,ZIM,Sikandar Raza,Prince Yadav,"Prince Yadav to Sikandar Raza, no run, 134kph delivery on full length around off, Raza push-drives it to mid-off but there is no single on offer"
1784805842118,$undefined,1,ZIM,,,"<b>Wicket off the first ball of a T20I by an India bowler</b><br>Shayan Jahangir (USA) - Arshdeep Singh, Nassau, T20 WC 2024<br>Saim Ayub (PAK) - Hardik Pandya, Dubai, Asia Cup 2025<br>Brian Bennett (ZIM) - Mayank Yadav, Harare, 2026<br><br><b>India bowlers with wickets off the first ball of a T20I innings</b><br>Bhuvneshwar Kumar (thrice)<br>Hardik Pandya (twice)<br>Arshdeep Singh (twice)<br>Mayank Yadav (twice)<br>Ravichandran Ashwin (once)<br><i>Mayank Yadav had dismissed Bangladesh’s Parvez Hossain Emon on the first ball of their 298-run chase in Hyderabad in October 2024 (his previous T20I outing).</i>"
1784805900946,4.1,1,ZIM,Dion Myers,Mayank Yadav,"Mayank Yadav to Dion Myers, no run, tailing into the batter at 147kph, Myers tries to tuck it but ends up getting hit on the pads"
1784805947546,$undefined,1,ZIM,Dion Myers,Mayank Yadav,"Mayank Yadav to Dion Myers, <b>THATS OUT!!</b> Caught!!"
1784805948214,4.2,1,ZIM,Dion Myers,Mayank Yadav,"Mayank Yadav to Dion Myers, <b>out</b> Caught by Shivam Dube!! <b>What a comeback this is turning out to be for Mayank Yadav!</b> The paceman is hitting the length, bowling as fast as he can and Zimbabwe batters are having a tough time against him. A bit of inward movement and Myers flat-bats it off the inner part of the bat and it goes straight into the hands of Dube at mid-on. <b>Dion Myers c Shivam Dube b Mayank Yadav 6(14) [4s-1]</b>"
1784806022158,$undefined,1,ZIM,Ryan Burl,Mayank Yadav,"<b>Ryan Burl, left handed bat, comes to the crease</b>"
1784806046902,4.3,1,ZIM,Ryan Burl,Mayank Yadav,"Mayank Yadav to Ryan Burl, no run, full and slanting away the length, Burl steers it to point and does it away from his body"
1784806084719,4.4,1,ZIM,Ryan Burl,Mayank Yadav,"Mayank Yadav to Ryan Burl, no run, just manages to drop his bat at the last second! Back of a length on the stumps and it keeps going away from the batter. Burl wanted to poke but right decides to let it go to the keeper"
1784806128961,4.5,1,ZIM,Ryan Burl,Mayank Yadav,"Mayank Yadav to Ryan Burl, 1 run, Burl shuffles across for this 142kph length ball and pushes it to cover before scampering across for a quick single. A bit of yes and no, but had enough time to complete the run"
1784806176543,4.6,1,ZIM,Sikandar Raza,Mayank Yadav,"Mayank Yadav to Sikandar Raza, no run, tails into Sikandar Raza from back of a length at 142kph, Raza stands tall to work it behind square but is pinned on the thigh pads as the ball rolls to his right"
1784806180521,$undefined,1,ZIM,,,<i>Each of Mayank Yadav's six T20I wickets have come via the back-of-the-length or shorter deliveries</i>
1784806243726,5.1,1,ZIM,Ryan Burl,Prince Yadav,"Prince Yadav to Ryan Burl, no run, zags in very nicely from the leg stump, Burl wanted to flick it to the on-side but is beaten on the inside edge because of the movement"
1784806274796,5.2,1,ZIM,Ryan Burl,Prince Yadav,"Prince Yadav to Ryan Burl, no run, beats him on the inside edge once again, poor shot one would say. Length ball and comes in as Burl tries to flick it away from the body but the ball passes below his horizontal bat"
1784806309529,5.3,1,ZIM,Ryan Burl,Prince Yadav,"Prince Yadav to Ryan Burl, no run"
1784806342342,5.4,1,ZIM,Ryan Burl,Prince Yadav,"Prince Yadav to Ryan Burl, no run"
1784806435708,$undefined,1,ZIM,,,"Another review taken, and this looks close! But the height is umpire's call."
1784806454086,5.5,1,ZIM,Ryan Burl,Prince Yadav,"Prince Yadav to Ryan Burl, leg byes, 1 run, this looks close, Prince is confident and so is Kishan behind the stumps."
1784806494308,5.6,1,ZIM,Sikandar Raza,Prince Yadav,"Prince Yadav to Sikandar Raza, <b>FOUR</b>, to deep extra cover"
1784806560893,$undefined,1,ZIM,Ryan Burl,Ashok Sharma,<b>Ashok Sharma [1.0-0-10-0] is back into the attack</b>
1784806565316,6.1,1,ZIM,Ryan Burl,Ashok Sharma,"Ashok Sharma to Ryan Burl, no run"
1784806594823,6.2,1,ZIM,Ryan Burl,Ashok Sharma,"Ashok Sharma to Ryan Burl, <b>wide</b>, goes for the bumper this time but the line is outside leg, Burl did try to get some bat to it but couldn't"
1784806625963,6.2,1,ZIM,Ryan Burl,Ashok Sharma,"Ashok Sharma to Ryan Burl, no run"
1784806653221,6.3,1,ZIM,Ryan Burl,Ashok Sharma,"Ashok Sharma to Ryan Burl, no run, pinned on the helmet!"
1784806795635,6.4,1,ZIM,Ryan Burl,Ashok Sharma,"Ashok Sharma to Ryan Burl, <b>wide</b>, short and continues to go away, Burl throws kitchen sink at it but fails to make any connection, wide given"
1784806808026,6.4,1,ZIM,Ryan Burl,Ashok Sharma,"Ashok Sharma to Ryan Burl, no run"
1784806847730,6.5,1,ZIM,Ryan Burl,Ashok Sharma,"Ashok Sharma to Ryan Burl, 2 runs, to long-on"
1784806886490,6.6,1,ZIM,Ryan Burl,Ashok Sharma,"Ashok Sharma to Ryan Burl, 1 run, to deep backward point"
1784806886500,$undefined,1,ZIM,,,"<b>India seamers by lengths in Overs 1-6</b><br><b>Full (<6m): </b>0/8, 4 balls, ER: 12<br><b>Good (6-8m):</b>1/4, 15 balls, ER: 1.6<br><b>Hard (8-10m):</b> 2/7, 12 balls, ER: 3.5<br><b>Short (10m): </b>0/2, 6 balls, ER: 2<br><i>*excluding wides</i>"
1784806943523,$undefined,1,ZIM,Ryan Burl,Shivam Dube,"<b>Shivam Dube, right-arm medium, comes into the attack</b>"
1784806968203,7.1,1,ZIM,Ryan Burl,Shivam Dube,"Shivam Dube to Ryan Burl, 1 run, to deep square leg"
1784807072868,$undefined,1,ZIM,Sikandar Raza,Shivam Dube,"Shivam Dube to Sikandar Raza, <b>THATS OUT!!</b> Caught!!"
1784807074549,7.2,1,ZIM,Sikandar Raza,Shivam Dube,"Shivam Dube to Sikandar Raza, <b>out</b> Caught by (sub)Suryansh Shedge!! <b>Sikandar Raza c (sub)Suryansh Shedge b Shivam Dube 4(7) [4s-1]</b>"
1784807099323,$undefined,1,ZIM,Madhevere,Shivam Dube,"<b>Wessly Madhevere, right handed bat, comes to the crease</b>"
1784807117722,7.3,1,ZIM,Wessly Madhevere,Shivam Dube,"Shivam Dube to Madhevere, no run"
